{"$schema":"https://json-schema.org/draft/2020-12/schema","$id":"lily_l4_b86r13_provisioning_activation_v15","type":"object","additionalProperties":false,"required":["schema_version","gate_id","gate_sha256","accepted_gate_head_sha","hermetic_ci_head_sha","hermetic_ci_run_id","inspector_decision","owner_authorization_reference","scope","validation_seal"],"properties":{"schema_version":{"const":"lily_l4_breadth_b86r13_provisioning_activation_v15"},"gate_id":{"const":"l_4_breadth_b86r13_provisioning_gate_v15"},"gate_sha256":{"type":"string","pattern":"^[0-9a-f]{64}$"},"accepted_gate_head_sha":{"type":"string","pattern":"^[0-9a-f]{40}$"},"hermetic_ci_head_sha":{"type":"string","pattern":"^[0-9a-f]{40}$"},"hermetic_ci_run_id":{"type":"integer","minimum":1},"inspector_decision":{"const":"ACCEPTED"},"owner_authorization_reference":{"const":"B8.6R13 one-shot owner authorization"},"scope":{"const":"one_repo_relative_falsification_container_provisioning_only"},"validation_seal":{"const":{"accessed":false,"status":"sealed_not_accessed"}}}}
