{"accepted_gate_head_sha":"42bfe3da3c58103317a71edb33bcd0d280b3017c","gate_id":"l_4_breadth_b86r13_provisioning_gate_v15","gate_sha256":"7013e389599cc936f80dfa66f465bc5523d76975c223e0d5325526abb8246fc8","hermetic_ci_head_sha":"42bfe3da3c58103317a71edb33bcd0d280b3017c","hermetic_ci_run_id":30591744500,"inspector_decision":"ACCEPTED","owner_authorization_reference":"B8.6R13 one-shot owner authorization","schema_version":"lily_l4_breadth_b86r13_provisioning_activation_v15","scope":"one_repo_relative_falsification_container_provisioning_only","validation_seal":{"accessed":false,"status":"sealed_not_accessed"}}